{
  "run_id": "b2c3d4e5-f6a7-4890-b1c2-d3e4f5a6b7c8",
  "agent_id": "change_order",
  "agent_version": "1.0.0",
  "constitution_version": "1.2",

  "change_order": {
    "filename": "2401-CO-101-StructuralRevision-v1.pdf",
    "filename_conforms": true,
    "job_number": "2401",
    "co_number": "CO-101",
    "type_code": "CO",
    "description_slug": "StructuralRevision",
    "version": 1,
    "source_uri": "https://monoboard.sharepoint.com/sites/project-2401/Shared%20Documents/COs/2401-CO-101-StructuralRevision-v1.pdf",
    "received_at": "2026-05-03T15:30:00Z",
    "payload_hash": "sha256:b3c5d7e9f1a3b5c7d9e1f3a5b7c9d1e3f5a7b9c1d3e5f7a9b1c3d5e7f9a1b3c5"
  },

  "financials": {
    "amount": 7500,
    "contract_value": 850000,
    "schedule_impact_days": 2,
    "reason_code": "client_request"
  },

  "routing": {
    "assigned_to_role": "@PM",
    "target_channel_uri": "https://teams.microsoft.com/l/channel/19%3Aproject-2401-finance%40thread.tacv2",
    "target_scope": "teams_finance_channel",
    "routing_basis": "amount $7,500 below $10k escalation threshold; assigned to @PM per Delegation Register",
    "escalation_triggered": false
  },

  "resolution_path": "deterministic_tool",

  "resolution_path_attempts": [
    { "step": "schema_parse", "outcome": "fail", "failure_reason": "amount field requires structured extraction" },
    { "step": "deterministic_tool", "outcome": "success", "failure_reason": null }
  ],

  "sources_cited": [
    {
      "type": "sp_file",
      "uri": "https://monoboard.sharepoint.com/sites/project-2401/Shared%20Documents/COs/2401-CO-101-StructuralRevision-v1.pdf",
      "last_modified": "2026-05-03T15:25:00Z",
      "freshness_ok": true
    }
  ],

  "writes_proposed": [
    {
      "target_scope": "teams_finance_channel",
      "target_uri": "https://teams.microsoft.com/l/channel/19%3Aproject-2401-finance%40thread.tacv2",
      "write_type": "post",
      "content_summary": "CO-101 received for job 2401: $7,500, +2 days. Below $10k threshold. Routed to @PM."
    }
  ],

  "escalations_fired": [],

  "outcome": "routed"
}
